<?xml version="1.0" encoding="UTF-8"?>
<!DOCTYPE wallpapers SYSTEM "gnome-wp-list.dtd">
<wallpapers>
    <wallpaper deleted="false">
        <name>Tortuga</name>
        <filename>/usr/share/backgrounds/ultramarine-linux/38/tortuga-light.png</filename>
        <filename-dark>/usr/share/backgrounds/ultramarine-linux/38/tortuga-dark.png</filename-dark>
        <options>zoom</options>
        <author>Aikoyori Hoshiane</author>
    </wallpaper>
    <wallpaper deleted="false">
        <name>Ultramarine</name>
        <filename>/usr/share/backgrounds/ultramarine-linux/ultramarine/ultramarine-light.png</filename>
        <filename-dark>/usr/share/backgrounds/ultramarine-linux/ultramarine/ultramarine-dark.png</filename-dark>
        <options>zoom</options>
        <author>Aikoyori Hoshiane</author>
    </wallpaper>
        <wallpaper deleted="false">
        <name>brown concrete building on beach during daytime</name>
        <filename>/usr/share/backgrounds/ultramarine-linux/extras/tortuga-beach.jpg</filename>
        <options>zoom</options>
        <author>Christopher Ocean</author>
    </wallpaper>
    <wallpaper deleted="false">
        <name>Blue Ocean</name>
        <filename>/usr/share/backgrounds/ultramarine-linux/extras/blue-ocean.jpg</filename>
        <options>zoom</options>
        <author>manu schwendener</author>
        <license>CC0</license>
    </wallpaper>
    <wallpaper deleted="false">
        <name>Silhouette of Mountain</name>
        <filename>/usr/share/backgrounds/ultramarine-linux/extras/silhouette-of-mountain.jpg</filename>
        <options>zoom</options>
        <author>Elliott Englemann</author>
        <license>CC0</license>
    </wallpaper>
    <wallpaper deleted="false">
        <name>Star Trails</name>
        <filename>/usr/share/backgrounds/ultramarine-linux/extra/mountain-range.jpg</filename>
        <options>zoom</options>
        <author>M. Duro Jr.</author>
        <license>CC-BY-SA 4.0</license>
    </wallpaper>
     <wallpaper deleted="false">
        <name>Blueprint</name>
        <filename>/usr/share/backgrounds/ultramarine-linux/preview/blueprint.png</filename>
        <options>zoom</options>
        <author>Jaiden Riordan</author>
        <license>CC-BY-SA 4.0</license>
    </wallpaper>

</wallpapers>